mahalle,ilce,il,meta_desc,img1,img2,img3
Emek,Kepez,Antalya,"Emek Mahallesi'nde 2+1-3+1 satılık daireler. Güney cephe, krediye uygun, toplu taşımaya yakın.","https://www.emlakfirmasi.tr/images/emek-1.jpg","https://www.emlakfirmasi.tr/images/emek-2.jpg","https://www.emlakfirmasi.tr/images/emek-3.jpg"
Gülveren,Kepez,Antalya,"Gülveren Mahallesi uygun fiyatlı 2+1 daireler.","https://www.emlakfirmasi.tr/images/gulveren-1.jpg","",""
Ahatlı,Kepez,Antalya,"Ahatlı Mahallesi yatırım fırsatlı daireler.","https://www.emlakfirmasi.tr/images/ahatli-1.jpg","",""
karşıyaka,Kepez,Antalya,"Karşıyaka Mahallesi uygun fiyatlı 2+1 daireler.","https://www.emlakfirmasi.tr/images/karsiyaka-1.jpg","",""
Yeniemek,Kepez,Antalya,"yeniemek Mahallesi uygun fiyatlı 2+1 daireler.","https://www.emlakfirmasi.tr/images/yeniemek-1.jpg","",""
Teomanpaşa,Kepez,Antalya,"Teomanpaşa Mahallesi uygun fiyatlı 2+1 daireler.","https://www.emlakfirmasi.tr/images/teomanpaşa-1.jpg","",""
